{
  "root": "/Users/fixture/CerebralHelm/knowledge",
  "notes": [
    {
      "path": "projects/atlas/kickoff.md",
      "title": "Atlas kickoff",
      "noteId": "ch-note-001",
      "folder": "projects/atlas",
      "project": "atlas",
      "sensitivity": "private",
      "updated": "2026-06-23T18:04:00Z"
    },
    {
      "path": "inbox/Hull Plating.md",
      "title": "Hull Plating",
      "folder": "inbox",
      "updated": "2026-06-22T09:15:00Z"
    }
  ],
  "total": 2,
  "truncated": false
}
